experiment,turn,question,input_tokens,output_tokens,cache_creation_input_tokens,cache_read_input_tokens,invocation_latency
1,1,Please summarize the story.,1971,239,0,0,12.855657577514648
1,2,What is the subject of the story?,4,104,2218,0,4.44450569152832
1,3,Where did Romeo and Juliet first meet?,4,90,2336,0,3.400867223739624
1,4,What is the name of the woman Romeo loved before?,4,76,2441,0,2.6657495498657227
1,5,How does Mercutio die?,4,126,2529,0,4.940775394439697
1,6,What method did Juliet use to fake her death?,4,109,2671,0,3.655229330062866
